med_event_ID,conflict_country,conflict_counry_ID,conflict_id,med_location - MULTISELECT,med_loc_cty,med_loc_x,med_loc_y,Day,Month,Year,third_party,third_party_id_GLOPAD,third_party_id,third_party_id_PAX,num_med,individual_med_named,groupings_mechanisms,num_local,if_loc_belig,agmt,ceasefire,agmt_name,agmt_id_PAX,Summary,source_urls,med_type
LIB202402-15,Libya,620,,Tripoli,LBN,35.8344,34.4367,9,2,2024,France,CON_7,CON_7,220,1,Paul Soler,,1,1,0,,,,"The French President's special envoy to Libya, Paul Soler, reaffirmed his country's support for the efforts to unify the Libyan army, reduce illegal immigration, and combat cross-border crime. In a meeting with the representative of the Presidential Council, Mossa Al-Koni, Paul Soler expressed his country's readiness to cooperate with the relevant authorities in Libya and provide it with the logistical capabilities to perform its tasks in securing the borders. Paul Soler also stressed the need to continue consultation with countries interested in Libya in cooperation with political parties in order to reach concrete agreements that lead to holding elections whose results are acceptable to all participants, in addition to supporting efforts aimed at reconstruction, especially the southern region. The French envoy indicated that the Libyan file was one of his country's first concerns, seeking to help Libya address the political impasse by communicating with political parties to achieve stability and reach elections. Al-Koni pointed to the neutrality of the Presidential Council toward consensus among all parties to address the political impasse, noting that the national reconciliation file had reached advanced stages. He commended the level of Libyan-French relations and the importance of developing them in various fields that would contribute to accelerating the achievement of stability and reconstruction. Al-Koni said that the efforts aimed at controlling the borders, especially the southern ones, to confront the threats of the flow of illegal immigration and terrorism, as an important point for cooperation between Libya and France.",https://libyaobserver.ly/news/french-envoy-discusses-al-koni-unification-libyan-army,MR
LIB202403-16,Libya,620,,Tripoli,LBN,35.8344,34.4367,12,3,2024,United Kingdom,CON_19,CON_19,200,1,Martin Longden,,1,1,0,,,,"Interior Minister Emad Trabulsi discussed efforts to secure Libya's borders with the British Ambassador to Libya, Martin Longden. Trabulsi received the British diplomat and his accompanying delegation at the Ministry's HQ in Tripoli on Tuesday.  According to the Ministry of Interior, the parties discussed prospects for security cooperation and plans to combat crime, human trafficking, smuggling, and illegal migration. On his X account, Ambassador Longden lauded the discussions with Minister Trabulsi and emphasized that the key to long-term security and stability in Libya lies in the success of the political process.",https://libyaobserver.ly/inbrief/trabulsi-reviews-border-security-and-migration-control-british-ambassador,MR
LIB202404-17,Libya,620,,Jado,LBY,12.0167,31.95,8,4,2024,UNSMIL,IGO_750,IGO_750,,1,Abdoulaye Bathily,UNSMIL process,2+,,0,,,,"As part of my wider outreach, I travelled to Bani Walid on 4 March, in a first visit of an SRSG since 2012, as well as to Tarhuna and Jado on 4 and 8 April, respectively, where I engaged with local communities, tribal leaders and political activists of these marginalised western cities",https://unsmil.unmissions.org/sites/default/files/20240416-_srsg_remarks_to_secco_eng_final.pdf,MR
LIB202404-18,Libya,620,,Tripoli,LBN,35.8344,34.4367,9,4,2024,Germany,CON_2;CON_2,CON_2; CON_2,255; 260,1,Michael Ohnmacht,,1,1,0,,,,"The Chief of the General Staff of the Libyan Army, Mohammed Al-Haddad, has discussed with the German Ambassador to Libya, Michael Ohnmacht, the latest military and security developments in Libya. In a post on his X platform page, Ohnmacht described the meeting with Al-Haddad as “fruitful,” noting that he stressed the importance of coordination and cooperation between relevant actors to achieve stability, security, and unify the army. He pointed out that the meeting touched on exploring views on future cooperation between Libya and Germany.",https://libyaobserver.ly/inbrief/german-ambassador-says-he-had-fruitful-meeting-chief-general-staff-libyan-army,MR
LIB202403-17,Libya,620,,Tripoli,LBN,35.8344,34.4367,12,3,2024,Congo,CON_42,CON_42,484,1,,,1,1,0,,,,"The member of the Presidential Council, Abdullah Al-Lafi, discussed with the Congolese ambassador to Libya preparations for the comprehensive conference on national reconciliation. This meeting came on Tuesday, as Congo-Brazzaville President Denis Sassou Nguesso chairs the high-level committee on Libyan affairs affiliated with the African Union. A statement published by the Presidential Council cited the ambassador as saying, “President Nguesso praised the steps taken by the Presidential Council on the path to laying the foundations for reconciliation and stability in the country.” The statement added that the meeting reviewed the exerted efforts to make the national reconciliation project successful, and to prepare for the inclusive reconciliation conference, with the participation of all major parties in the political process.",https://libyaobserver.ly/inbrief/al-lafi-congolese-ambassador-discuss-preparations-libya-reconciliation-conference,MR
LIB202403-18,Libya,620,,Tripoli,LBN,35.8344,34.4367,17,3,2024,UNSMIL,IGO_750,IGO_750,,1,Abdoulaye Bathily,UNSMIL process,1,1,0,,,,"Vice President of the Presidential Council (PC) Abdullah Al-Lafi met with UN Envoy Abdoulaye Bathily on Sunday to discuss developments in Libya's political situation. The meeting addressed the ongoing deadlock, progress in the national reconciliation file, and efforts towards convening the comprehensive national conference with the participation of all relative parties. Al-Lafi reaffirmed the PC's support for the UN mission's initiatives to advance the political process, achieve stability and prepare for an electoral process. For his part, Bathily reiterated the UN mission's support for the PC's efforts in implementing the national reconciliation project.",https://libyaobserver.ly/inbrief/al-lafi-bathily-discuss-libyas-political-stalemate,MR
LIB202404-19,Libya,620,,Tunis,TUN,10.1817,36.8064,22,4,2024,UNSMIL,IGO_750,IGO_750,,1,,UNSMIL process,2+,1,0,,,,"As the result of a meeting convened by UNSMIL, in collaboration with the Presidential Council, in Tunis on 22 and 23 April, members of the House of Representatives and the legal committee of the Presidential Council agreed to consolidate various draft laws into a single, unified draft law on transitional justice and national reconciliation. However, on 5 May, the High Council of State rejected the draft reconciliation law prepared by the Presidential Council, emphasizing that a new legal framework was not needed because Act No. 29 on Transitional Justice had been adopted by the General National Congress",https://unsmil.unmissions.org/sites/default/files/sg_report_s_2024_598.pdf,M
LIB202404-20,Libya,620,,Tripoli,LBN,35.8344,34.4367,7,4,2024,France,CON_7,CON_7,220,1,Mostafa Mihraje,,1,1,0,,,,"The Head of the Libyan Presidential Council, Mohammed Menfi, has discussed with the French ambassador Mostafa Mihraje the latest political developments and the current stalemate in Libya, especially after Cairo meeting as well as the security situation and regional crises. Mihraje added on his X account that they had exchanged views on the political situation as Menfi informed him of the latest update on preparations for the humanitarian conference on Sudan that would take place on April 15 in Paris.",https://libyaobserver.ly/inbrief/head-libyas-presidential-council-discusses-french-ambassador-political-stalemate,MR
LIB202404-21,Libya,620,,Tripoli,LBN,35.8344,34.4367,21,4,2024,Italy,CON_139,CON_139,325,1,Gianluca Alberini,,1,1,0,,,,"The Deputy Head of the Presidential Council, Abdullah Al-Lafi, discussed with the Italian ambassador to Libya, Gianluca Alberini, developments in the political process in Libya and a number of regional issues of common interest. The Presidential Council's media office explained that the meeting reviewed the challenges facing the national reconciliation project, and ways to strengthen the efforts to make it successful. The meeting also discussed developments in the political process in the country, in light of recent events, especially the resignation of the UN envoy to Libya, Abdoulaye Bathily, as well as a number of other regional issues taking place in the Middle East. Al-Lafi stressed the importance of the Italian role in supporting a peaceful solution to the crisis in Libya.  Italy's ambassador reaffirmed that his country supports all the Presidential Council's efforts to restore confidence among all political parties, to achieve the aspirations of Libyans, and to preserve the unity and stability of their country.",https://libyaobserver.ly/news/al-lafi-and-italian-ambassador-discuss-political-developments-libya,MR
LIB202404-22,Libya,620,,Addis Ababa,ETH,38.74,9.03,25,4,2024,Ethiopia,CON_159,CON_159,530,1,Abiy Ahmed Ali,,1,1,0,,,,"Ethiopian Prime Minister Abiy Ahmed Ali received yesterday at the Presidential Palace in Addis Ababa, Tripoli based Libyan Prime Minister and Minister of Defence Abd Alhamid Aldabaiba and his accompanying delegation. The Tripoli government reported that they held an expanded meeting, in the presence of the Ministers of Finance, Transportation, Youth, Labour and Rehabilitation and State for Cabinet Affairs from the Libyan side. On the Ethiopian side the Ministers of Labour, Irrigation and Water Resources, Infrastructure and Reconstruction, Foreign Affairs and Advisor to the Prime Minister, attended. Abiy Ahmed, the Tripoli government reported, welcomed Aldabaiba’s visit to Ethiopia, ‘‘considering it an important step for the return of cooperation between the two countries after a hiatus of more than twenty years’’. Aldabaiba, meanwhile, affirmed Libya’s desire to restore cooperation between the two countries in all political, economic, and security fields through consultation and communication between the two governments, and coordination on various regional issues of concern. Several political files between the two countries were discussed, and there was an emphasis on unifying and supporting efforts on the African continent to support Libya to hold elections and end the transitional stages. ",https://libyaherald.com/2024/04/tripoli-based-libyan-pm-aldabaiba-meets-ethiopian-pm-in-addis-ababa/,MR
LIB202405-24,Libya,620,,Tripoli,LBN,35.8344,34.4367,7,5,2024,Italy,CON_139,CON_139,325,1,Giorgia Meloni,,1,1,0,,,,"Meloni on Tuesday also met Mohamed al-Menfi, head of the Libyan transitional presidential council. In a statement on Facebook, Menfi's office highlighted ""the importance of the return of Italian companies... to reconstruction projects"" as well as maintaining ""consultations in the areas of the fight against terrorism and illegal migration"". ",https://www.france24.com/en/live-news/20240507-italy-pm-meloni-in-libya-to-sign-cooperation-deals,MR
LIB202405-25,Libya,620,,Tripoli,LBN,35.8344,34.4367,27,5,2024,United States,CON_3,CON_3,2,1,Jeremy Berndt,,1,1,0,,,,"Earlier, during his meeting with Presidential Council member Musa Al-Koni, Berndt affirmed his country’s support for the efforts of the United Nations Support Mission in Libya to perform its tasks in order to achieve stability and reach elections.",https://libyaobserver.ly/inbrief/takala-discusses-berndt-american-support-political-solution-libya,MR
LIB202405-26,Libya,620,,Ankara,TUR,32.85,39.93,31,5,2024,Turkey,CON_562,CON_562,640,1,Recep Tayyip Erdoğan,,1,1,0,,,,"President Recep Tayyip Erdoğan discussed Türkiye-Libya relations, Israel’s attacks on Gaza and regional and global developments with Tripoli-based unity Prime Minister Abdul Hamid Dbeibah at the Presidential Complex in the capital Ankara on Friday. Erdoğan told Dbeibah that Türkiye is ready to provide support to start a dialogue process for establishing unity in Libya while preserving the legitimacy of the National Unity Government. The two leaders also touched upon bilateral energy cooperation, as Erdoğan said it is crucial to keep close contact to protect mutual interests in the Eastern Mediterranean. Erdoğan also welcomed Libya’s support to the Palestinian cause, as he said Tripoli’s decision to join the International Court of Justice (ICJ) case against Israel’s genocide in Gaza was on point. ",https://www.dailysabah.com/politics/diplomacy/turkiye-backs-efforts-for-unity-dialogue-in-libya-erdogan-to-dbeibah,MR
LIB202406-9,Libya,620,,Tripoli,LBN,35.8344,34.4367,15,6,2024,UNSMIL,IGO_750,IGO_750,,1,Stephanie Koury,UNSMIL process,1,1,0,,,,"The acting Foreign Minister Al-Taher Al-Baour has received the Deputy Special Representative of the Secretary-General of the United Nations in Libya and Acting Head of the United Nations Mission, Stephanie Khoury. During the meeting, which took place at the Foreign Ministry, the two parties discussed the course of the political process in Libya, with Khoury informing Al-Baour of the results of her recent tour of the country, which included meetings with various Libyan parties. Khoury also reviewed her plan of action proposals for the coming period, welcoming the High National Elections Commission’s decision to hold local elections for municipal councils.",https://libyaobserver.ly/inbrief/foreign-ministry-discusses-united-nations-course-political-process-libya,MR
LIB202406-10,Libya,620,,Tripoli,LBN,35.8344,34.4367,24,6,2024,United States,CON_3,CON_3,2,1,Richard Norland,,1,1,0,,,,"Chairman of the Presidential Council of Libya Mohamed Al Menfi discussed with US Special Envoy for Libya Richard Norland the latest developments in the political situation in Libya. The two sides also discussed the security and military situation in Libya, and means to realize stability throughout the country.",https://www.gulf-times.com/article/685367/region/chairman-of-libyas-presidential-council-us-special-envoy-discuss-latest-developments,MR
LIB202408-14,Libya,620,,Tripoli,LBN,35.8344,34.4367,4,8,2024,United States,CON_3,CON_3,2,1,Richard Norland,,1,1,0,,,,"Deputies of the Libyan Presidential Council Musa Al-Koni and Abdullah Al-Lafi, discussed on Tuesday with the US envoy to Libya Richard Norland, the developments of the Political process in Libya. The media office of the Presidential Council said that the two sides stressed during the meeting the importance of combining local and international efforts concerned with the Libyan issue, to prepare a political project that addresses the deadlock and paves the way for achieving the electoral entitlements. The meeting touched on the service and security conditions in the southern region, in coordination with the Presidential Council..... On Tuesday, deputies of the Libyan Presidential Council, Musa Al-Koni and Abdullah Al-Lafi, held discussions with Richard Norland, the US envoy to Libya, regarding the current state of the Political process in Libya. The meeting, according to the media office of the Presidential Council, focused on the ongoing challenges and developments within the country and emphasized the need for a coordinated approach to address the political deadlock. Both parties underscored the importance of integrating local and international efforts to craft a political strategy that could break the impasse and facilitate the achievement of electoral objectives. They agreed on the necessity of aligning local initiatives with international support to create a comprehensive plan that addresses the underlying issues and advances the political process. The discussion also covered the service and security conditions in Libya’s southern region. The deputies and the US envoy explored ways to improve these conditions, emphasizing the need for effective coordination with the Presidential Council to address the region’s challenges. The meeting highlighted the mutual commitment to advancing Libya’s political stability and development. By focusing on both local and international collaboration, they aimed to establish a framework that could lead to meaningful progress in Libya’s political and electoral landscape.",https://menafn.com/1108525017/Libya-US-Discuss-Political-Process-Developments; https://menafn.com/1108526548/Libyan-US-officials-talk-over-state-of-political-process-in-Libya,MR
LIB202406-11,Libya,620,,Tripoli,LBN,35.8344,34.4367,11,6,2024,UNSMIL,IGO_750,IGO_750,,1,,UNSMIL process,2+,,0,,,,"The United Nations Support Mission in Libya (UNSMIL) held its last quarterly meeting of the working group on disarmament, demobilization and reintegration (DDR), last Tuesday, with representatives of the Libyan authorities, international partners and civilian activists from all over the country. The mission said in a statement, Saturday, that the meeting, which location was not specified, focused on preventing the outbreak of conflicts, Libyan efforts to address the spread of weapons, reducing societal violence, national reconciliation, and rehabilitating members of armed formations and integrating them into society. The participants discussed the need for the DDR process to provide alternatives to recruitment into armed formations and build community cohesion. They suggested holding social discussions among young people and holding appropriate meetings for women in a manner consistent with the culture and customs of Libyan society, to enhance their confidence in peace and eliminate the main drivers of violence, according to the statement.",https://libyaobserver.ly/news/unsmil-announces-outcomes-ddr-team,MR
LIB202408-15,Libya,620,,Muscat,OMN,58.5922,23.6139,12,8,2024,Oman,CON_606,CON_606,698,1,Khalifa bin Ali al-Harthy; Zainab bint Said al Qasmiyah,,1,1,0,,,,"The Sultanate of Oman and the State of Libya discussed means of promoting relations in various areas. During a meeting held in Muscat on Monday, Sheikh Khalifa bin Ali al Harthy, Under-Secertary of the Foreign Ministry for Diplomatic Affairs, and Mohamed Khalil Issa, Deputy Foreign Minister for Political Affairs of Libya, discussed the latest political developments in Libya. The two sides also touched on the most important issues at the regional level. The meeting was attended by Hajer Amr Al Nami, Ambassador of Libya to the Sultanate of Oman, Dr Zainab bint Said al Qasmiyah, Head of the Diplomatic Academy, and a number of officials from both sides.",https://www.omanobserver.om/article/1157586/oman/oman-libya-review-means-of-promoting-relations,MR
LIB202408-16,Libya,620,,Tripoli,LBN,35.8344,34.4367,12,8,2024,United Kingdom,CON_19,CON_19,200,1,Martin Longden,,1,1,0,,,,"Vice President of the Presidential Council (PC), Moussa Al-Koni, met with UK Ambassador Martin Longden on Monday to discuss recent developments in southern Libya.  The meeting, held in Tripoli, followed Longden’s visit to the city of Sabha, where he engaged with local officials and residents about the ongoing challenges in the region. Al-Koni welcomed the ambassador’s attention to Libya, emphasizing the strategic importance of southern Libya as a key region rich in resources.  He advocated for a shift towards a governorate system, arguing that it would enable a more equitable distribution of resources, reduce corruption, and streamline the delivery of services to citizens, thereby easing the burden on the central government. The discussions also covered broader political developments in Libya, with a focus on issues such as illegal immigration and its effects on both Libya and the wider Mediterranean region.",https://libyaobserver.ly/news/al-koni-discusses-southern-libya-and-governance-uk-ambassador,MR
LIB202408-17,Libya,620,,Tripoli,LBN,35.8344,34.4367,14,8,2024,Qatar,CON_486,CON_486,694,1,Khaled al-Dosari,,1,1,0,,,,"Abdullah Al-Lafi, the Vice President of the Presidential Council (PC), has convened with Qatar’s Ambassador to Libya, Khalid Al-Dosari, to address ongoing developments in the national reconciliation process.  The focus was on evaluating the progress made by the Preparatory Committee for Reconciliation and exploring strategies for advancing a Libyan-led initiative.  According to the PC media office, the Qatari ambassador reaffirmed his country’s support for the decisions of the Libyan people and for endeavours that promote stability and territorial integrity within Libya. For his part, Al-Lafi emphasized the need for coordinated local and international efforts to launch a well-structured political project that would end the current political stagnation and facilitate the path to elections.",https://libyaobserver.ly/inbrief/al-lafi-discusses-national-reconciliation-updates-qatars-ambassador,MR
LIB202409-13,Libya,620,,Tripoli,LBN,35.8344,34.4367,5,9,2024,Turkey,CON_562,CON_562,640,1,Ibrahim Kalin; Cemalettin Celik,,1,1,0,,,,"Kalin, accompanied by his deputy Cemalettin Celik, visited Tripoli on Thursday, where they held talks with Abdul Hamid Dbeibeh, the head of the National Unity Government, focusing on resolving internal conflicts, with Kalin reaffirming his country’s commitment to Libya’s unity and stability. During his meeting with the head of Turkish intelligence, Dbeibeh addressed bilateral relations and mutual interests, including current developments in the Middle East, notably the situation in Gaza, according to a statement from the National Unity Government. Turkish security sources noted that the discussions emphasized the importance of joint efforts to support regional stability and civilian protection, with a focus on strengthening cooperation in political and security matters. The National Unity Government noted that Kalin and Dbeibeh’s meeting centered on bilateral relations and shared concerns, particularly developments in Gaza. Both parties emphasized the need for joint efforts to enhance regional stability and protect civilians, with a focus on deepening political and security cooperation.....The head of Turkish intelligence, Ibrahim Kalin, held discussions with Libyan officials in Tripoli to explore potential solutions through an inclusive national dialogue aimed at preserving the unity and stability of Libya. Kalin, accompanied by his deputy Cemalettin Celik, visited Tripoli on Thursday, where they held talks with Abdul Hamid Dbeibeh, the head of the National Unity Government, as well as members of the Libyan Presidential Council, focusing on resolving internal conflicts, with Kalin reaffirming his country’s commitment to Libya’s unity and stability. Before meeting with Dbeibeh, Kalin and Celik also held talks with Libyan Presidential Council deputies Abdullah al-Lafi and Musa al-Koni. They discussed Libya’s recent political developments and ways to bolster stability and advance the political process. A statement from the Presidential Council emphasized that Libyan officials stressed the need for a unified national will to address current challenges.",https://english.aawsat.com/arab-world/5058527-turkish-intelligence-moves-%E2%80%98heal-rift%E2%80%99-libya,MR
LIB202409-14,Libya,620,,Tripoli,LBN,35.8344,34.4367,8,9,2024,DPPA,GP-20,,,1,Rosemary DiCarlo,,1,1,0,,,,"During the visit, Ms. DiCarlo met with Prime Minister Abdulhamid Al Dabiba and Acting Foreign Minister Eltaher Elbaour, raising concerns about the rapid deterioration of the political and security situation….She also met with President of the Presidential Council Mohamed Menfi and his deputies Abdullah Lafi and Moussa Koni. She stressed the need to resolve the crisis around the Central Bank of Libya and to advance a rights-based national reconciliation process.",https://unsmil.unmissions.org/statement-end-visit-libya-un-under-secretary-general-political-and-peacebuilding-affairs-rosemary,MR
LIB202409-15,Libya,620,,Tripoli,LBN,35.8344,34.4367,23,9,2024,United States,CON_3,CON_3,2,1,Steven Wallender; John Brennan; Jeremy Berndt,,1,1,0,,,,"Prime Minister of the Government of National Unity (GNU) Abdul Hamid Dbeibah has met with a US delegation led by Assistant Secretary of Defence for International Security Affairs Celeste Wallander to discuss security cooperation and regional stability. The delegation, which also included AFRICOM Deputy Commander John Brennan and Acting US Ambassador to Libya Jeremy Brint, emphasized the need for continued oil flow to stabilize Libya’s economy and stressed the importance of holding elections, as per a statement by the GNU media office. The talks also covered the unification of Libya’s military forces and efforts to address illegal migration. Both sides reaffirmed their commitment to enhancing bilateral security cooperation and supporting Libya’s stability.",https://libyaobserver.ly/news/us-deputy-defence-secretary-meets-dbeibeh-and-haftar-libya,M
LIB202410-12,Libya,620,,Moscow,RUS,37.6172,55.7558,1,10,2024,Russia,CON_21,CON_21,365,1,Mikhail Bogdanov,,1,1,0,,,,"Russian Presidential Special Envoy for the Middle East and Africa and Deputy Foreign Minister Mikhail Bogdanov and Libyan Ambassador to Russia Mohamed Magrawi discussed the development of the situation in and around Libya. ""During the conversation, the sides paid special attention to the development of the situation in and around Libya. At the same time, Russia confirmed its readiness to further promote the Libyan inclusive political process in order to achieve a lasting settlement in this country,"" the Russian Foreign Ministry said in a statement. As the ministry noted, some practical issues concerning further strengthening of traditionally friendly Russian-Libyan ties were also discussed. The meeting was held at the request of the Libyan side.",https://tass.com/politics/1850535,MR
