med_event_ID,conflict_country,conflict_counry_ID,conflict_id,med_location - MULTISELECT,med_loc_cty,med_loc_x,med_loc_y,Day,Month,Year,third_party,third_party_id_GLOPAD,third_party_id,third_party_id_PAX,num_med,individual_med_named,groupings_mechanisms,num_local,if_loc_belig,agmt,ceasefire,agmt_name,agmt_id_PAX,Summary,source_urls,med_type
LIB202301-20,Libya,620,,Tripoli,LBN,35.8344,34.4367,28,1,2023,Italy,CON_139,CON_139,325,1,Giorgia Meloni; Antonio Tajani; Matteo Piantedosi,,1,1,0,,,,"Italian Prime Minister Giorgia Meloni visited Tripoli on Saturday for talks with the internationally-recognized government in the Libyan capital. She became the first Western leader to visit the government in Libya since it missed its late 2021 target to hold national elections amid political turmoil in the country. During the visit, the two countries' oil companies signed a gas deal worth around $8 billion (roughly €7.5 billion), calling it the largest single investment in Libya's energy sector in more than two decades. ENI CEO Claudio Descalzi and NOC chairman Farhat Begdara signed the deal at a ceremony also attended by Meloni and the head of Libya's UN-brokered but contested national unity government, Abdel Hamid Dbeibah. Meloni landed at Mitiga airport, the only functioning airport in Tripoli at present, amid tight security. Her foreign and interior ministers, Antonio Tajani and Matteo Piantedosi, accompanied her. She met with the leader of the UN-brokered government Dbeiba and held talks with Mohamed Younis Menfi, who chairs Libya's ceremonial presidential council..... Italy's Prime Minister Giorgia Meloni landed in Libya's capital Tripoli on an official visit, Libyan state media reported. The Prime Minister was received by the head of the National Unity Government Abdul Hamid Dbeibah based in Tripoli, who she is supposed to hold talks with on energy and immigration.... The Libyan outgoing Prime Minister, Abdul Hamid Dbeibeh, received the Italian Prime Minister, Georgia Meloni, and her accompanying delegation in Tripoli on Saturday, according Dbeibeh’s Media Office. The Italian Nova News Agency said on Thursday that Meloni intends to visit Libya, on Saturday, at the head of a delegation that includes Foreign Minister Antonio Tajani and Interior Minister Matteo Piantidossi.... Italy’s prime minister held talks in Libya on Saturday with officials from the country’s west-based government focusing on energy and migration, top issues for Italy and the European Union. During the visit, the two countries’ oil companies signed a gas deal worth $8 billion - the largest single investment in Libya’s energy sector in more than two decades.... A visiting Italian delegation headed by Prime Minister Giorgia Meloni on Saturday signed agreements on enhancing cooperation in various fields with Libya in the Libyan capital Tripoli. Libyan Prime Minister Abdul-Hamed Dbeibah told a joint press conference along with Meloni that they discussed increasing cooperation in the fields of energy, economy, border control and combating illegal immigration, as well as coordination of political positions between the two countries. The foreign ministers of the two states also signed a memorandum of understanding, under which Italy will provide Libya with five fully equipped ships to be used for search and rescue operations, Dbeibah said. Italian energy company Eni and Libyan National Oil Corporation agreed on the development of Structures A&E, a strategic project aimed at increasing gas production to supply the Libyan domestic market and ensure gas export to Europe, Eni said in a statement.... Italy's Prime Minister Giorgia Meloni landed in Libya's capital Tripoli on an official visit, Libyan state media reported. The Prime Minister was received by the head of the National Unity Government Abdul Hamid Dbeibah based in Tripoli, who she is supposed to hold talks with on energy and immigration. ... Italy’s prime minister held talks in Libya on Saturday with officials from the country’s west-based government focusing on energy and migration, top issues for Italy and the European Union. During the visit, the two countries’ oil companies signed a gas deal worth $8 billion – the largest single investment in Libya’s energy sector in more than two decades.... Italian Premier Giorgia Meloni extended a hand of friendship to Tripoli while also helping to secure her country's energy security. Italian energy giant signed an $8bn gas exploration contract with Libya's state energy company during the visit. ... A visiting Italian delegation headed by Prime Minister Giorgia Meloni on Saturday signed agreements on enhancing cooperation in various fields with Libya in the Libyan capital Tripoli. Libyan Prime Minister Abdul-Hamed Dbeibah told a joint press conference along with Meloni that they discussed increasing cooperation in the fields of energy, economy, border control and combating illegal immigration, as well as coordination of political positions between the two countries. The foreign ministers of the two states also signed a memorandum of understanding, under which Italy will provide Libya with five fully equipped ships to be used for search and rescue operations, Dbeibah said. Italian energy company Eni and Libyan National Oil Corporation agreed on the development of Structures A&E, a strategic project aimed at increasing gas production to supply the Libyan domestic market and ensure gas export to Europe, Eni said in a statement.... ",https://allafrica.com/stories/202301290068.html; https://english.almayadeen.net/news/politics/meloni-eyes-african-oil-gas-lands-in-libya-after-algeria-vis;https://libyaupdate.com/dbeibeh-receives-italian-prime-minister-in-tripoli/; https://www.gulftoday.ae/business/2023/01/28/italy-and-libya-sign-$8-billion-gas-agreement-as-meloni-visits-tripoli; https://www.breitbart.com:443/europe/2023/01/28/italian-pm-meloni-inks-libyan-natural-gas-deal-during-tripoli-visit/; http://www.euronews.com/2023/01/28/giorgia-meloni-visits-tripoli-as-libya-signs-8bn-gas-exploration-deal-with-eni; https://www.aljazeera.com/news/2023/1/28/italys-meloni-in-libya-to-conclude-8bn-gas-deal; https://www.bignewsnetwork.com/news/273448079/libya-italy-sign-agreements-to-enhance-cooperation; https://www.dw.com/en/italy-inks-gas-deals-with-libyas-contested-government/a-64546745; http://www.hngn.com/articles/246489/20230129/italy-prime-minister-visits-libya-acquire-natural-gas-supplies.htm; https://maritime-executive.com/article/italy-and-libya-reach-8b-deal-on-offshore-gas-development; https://tribune.com.pk/story/2398246/italys-eni-signs-8b-libya-gas-deal,MR
LIB202303-9,Libya,620,,Tripoli,LBN,35.8344,34.4367,9,3,2023,United States,CON_3,CON_3,2,1,Richard Norland; Leslie Ordman,,1,1,0,,,,"Libyan Foreign Minister Najla Al-Mangoush told the US ambassador to Libya, Richard Norland, and Chargè d'affaires Leslie Ordman, about the latest developments in the political situation in Libya and they all reviewed ways to support the initiative of the UN envoy Abdoulaye Bathily. The Foreign Ministry said the meeting saw a discussion about the role of the Ministry in coordination and cooperation with the US for a successful political process under the auspices of the UN, while Al-Mangoush reiterated the importance of the Government of National Unity's work toward holding elections and ending transitional periods by unifying local and international efforts to that end. The US embassy said on Twitter that Norland had emphasized in his meeting with Al-Mangoush that the US stands side by side with the Libyan people in recognition of their right to elect their leaders. ",https://libyaobserver.ly/news/foreign-minister-tells-us-ambassador-her-government-stabilizing-libya,MR
LIB202303-10,Libya,620,,Tripoli,LBN,35.8344,34.4367,9,3,2023,United States; United Kingdom; France; Germany; Italy,CON_3;CON_19;CON_7;CON_2;CON_2;CON_139,CON_3; CON_19; CON_7; CON_2; CON_2; CON_139,2; 200; 220; 255; 260; 325,5,,,1,1,0,,,,"Libyan Prime Minister, Abdul Hamid Dbeibah, held a meeting with the ambassadors and envoys of the United States, Britain, France, Germany and Italy to Libya, (known as members of the ""p3 + 2"" group,) in Tripoli. Dbeibah's media office said the diplomats briefed the PM on the results of their recent meetings in the United States, the Security Council session on Libya, and the coordination of international efforts in support of elections. Meanwhile, Dbeibah reaffirmed his support for the efforts of the UN envoy Abdoulaye Bathily, saying they are consistent with the vision of the Government of National Unity for the next stage, especially holding elections, ending the transitional stages and unifying the local and international efforts to help Libya issue a free and fair constitutional basis. The foreign ambassadors and envoys confirmed their support for Bathily's efforts, which seek to hold elections before the end of this year, praising the work made by the GUN in this file and hailing its clear vision for elections.",https://libyaobserver.ly/news/libyan-pm-holds-meeting-foreign-diplomatic-officials-tripoli,MR
LIB202303-11,Libya,620,,Tripoli,LBN,35.8344,34.4367,10,3,2023,Algeria,CON_255,CON_255,615,1,Said Chenegriha,,1,1,0,,,,"The Chief of Staff of the Algerian People’s National Army, Lieutenant General Said Chenegriha, pledged on Thursday to help Libya overcome its security and political crisis, the Algerian Defense Ministry said in a statement. Chanegriha met with the Chief of the General Staff of the Libyan Army, Lieutenant General Mohamed Al-Haddad, at the headquarters of the Ministry, the statement added. During the meeting, the Algerian General stressed the importance of exchanging views on the developments in the region, and on bilateral cooperation to resolve problems. It expressed willingness to help organize general elections in the country with the aim of ending the crisis. He stressed that his country always seeks to be a stabilizing factor in the region, and contributes to sustainable development in neighboring countries.",https://english.aawsat.com/home/article/4203996/algerian-chief-staff-pledges-help-libya-resolve-its-crisis,MR
LIB202303-12,Libya,620,,Tripoli,LBN,35.8344,34.4367,21,3,2023,United States,CON_3,CON_3,2,1,Barbara Leaf,,1,1,0,,,,Libyan Minister of Foreign Affairs and International Cooperation Najla Al-Mangouch discussed here Tuesday with US Assistant Secretary of State for Middle East Affairs Barbara Leaf efforts of the national unity government to strengthen stability and prepare for elections in Libya,https://www.panapress.com/Najla-al-Mangouch-discusses-Liby-a_630742608-lang2.html,MR
LIB202310-9,Libya,620,,Tripoli,LBN,35.8344,34.4367,28,10,2023,Turkey,CON_562,CON_562,640,1,Ahmet Yildiz,,2+,1,0,,,,"The Turkish Deputy Foreign Minister began a working visit to Libya on Saturday, when he met with the Head of the Presidential Council Mohammed Menfi, the Head of the High Council of State, Mohammed Takala, and others, including the Governor of the Central Bank of Libya, Al-Siddiq Al-Kabir...Deputy Minister of Foreign Affairs Ambassador H.E. Mr. Ahmet Yıldız will pay a visit to Libya on 28 October through 1 November 2023. Following his meetings in Tripoli, Deputy Minister Yıldız will also travel to Benghazi to receive information from the authorities regarding the flood disaster in Derna.",https://libyaobserver.ly/news/libyan-pm-dbeibah-gives-green-light-reopening-turkish-consulate-benghazi; https://www.africa-newsroom.com/press/press-release-regarding-the-visit-of-ambassador-his-excellency-mr-ahmet-yildiz-deputy-minister-of-foreign-affairs-to-libya,MR
LIB202304-15,Libya,620,,New York,USA,-73.9249,40.6943,14,4,2023,Russia,CON_21,CON_21,365,1,Vasily Nebenzya,,1,1,0,,,,"Libya's ambassador to the United Nations, Taher El Sonni, discussed with the Russian counterpart, Vasily Nebenzya, in New York on Wednesday the developments in Libya and the challenges facing the political track as well as the electoral process. El Sonni said on Twitter that the meeting was within the framework of Russia's presidency of the Security Council this month and prior to the special session on Libya on April 18. The two ambassadors also discussed the role Russia can play to support stability in Libya, and the importance of joint action to support the will of Libyans to end the crisis and all kinds of external intervention.",https://libyaobserver.ly/inbrief/el-sonni-and-his-russian-counterpart-discuss-moscows-support-stability-libya,MR
LIB202305-12,Libya,620,,Tunis,TUN,10.1817,36.8064,4,5,2023,Tunisia,CON_590,CON_590,616,1,Kais Saied,,1,1,0,,,,"Tunisian President Kais Saied met with Libyan Foreign Minister Najla Mangoush on Wednesday to discuss bilateral ties and cooperation, as announced by the Tunisian Presidency in a statement. Saied emphasized the importance of reinforcing consultation and collaboration between Tunisia and Libya in various areas, including the economic, investment, energy, and security sectors. The Tunisian president reiterated his country’s unwavering stance on resolving the Libyan crisis, advocating for an approach centered on unity. Saied highlighted the need to overcome present challenges and increase meetings at all levels, expressing readiness to execute bilateral agreements. The statement also revealed that the meeting covered several regional and international matters of mutual interest.",https://themedialine.org/headlines/tunisian-president-libyan-foreign-minister-discuss-strengthening-cooperation/,MR
LIB202311-3,Libya,620,,Tunis,TUN,10.1817,36.8064,7,11,2023,UNSMIL; France; Italy; Turkey; United Kingdom; AU,IGO_750;CON_7;CON_139;CON_562;CON_19;GP-6,IGO_750; CON_7; CON_139; CON_562; CON_19; ,; 220; 325; 640; 200; ,6,Abdoulaye Bathily,International Follow-Up Committee on Libya (IFC); UNSMIL process,2+,1,0,,,,"From 7 to 9 November, UNSMIL organized a workshop in Tunis for the 5+5 Joint Military Commission, in the presence of the Special Representative and the co-chairs of the security working group (France, Italy, Türkiye, the United Kingdom of Great Britain and Northern Ireland and the African Union). Participants addressed progress achieved to date on the security track, as well as challenges faced in the implementation of the ceasefire agreement of 23 October 2020, including as regards the withdrawal of foreign fighters, foreign forces and mercenaries from Libya.",https://unsmil.unmissions.org/sites/default/files/sg_report_.pdf,M
LIB202311-4,Libya,620,,Egypt,EGY,30,27,8,11,2023,Egypt,CON_82,CON_82,651,1,,Egyptian Initiative,2+,1,0,,,,"Heads of rival assemblies, Aguila Saleh of HoR and Mohamad Takala of High Council of State, met in Egypt but failed to reach a breakthrough. Saleh continued to back HoR-approved election laws and called for formation of interim unity government, while Takala insisted that his assembly did not approve final version of laws and allegedly refused to back new government formation. ",,M
LIB202305-13,Libya,620,,Tripoli,LBN,35.8344,34.4367,10,5,2023,UNSMIL,IGO_750,IGO_750,,1,Abdoulaye Bathily,UNSMIL process,1,1,0,,,,"Bathily held other meetings and contacts in Tripoli to discuss the Libyan file. On Wednesday, the UN envoy met with President of the Libyan Presidential Council (LPC) Mohamed al-Manfi.",https://english.aawsat.com/arab-world/4323641-icc-track-down-perpetrators-%E2%80%98war-crimes%E2%80%99-libya,M
LIB202305-14,Libya,620,,Virtual ,0, , ,10,5,2023,United States,CON_3,CON_3,2,1,Richard Norland,,1,1,0,,,,"In a phone call on Wednesday, Norland discussed with Libyan Presidential Council member, Abdullah Al-Lafi, efforts towards national reconciliation in Libya and ways to progress towards holding elections on schedule. According to a tweet from the embassy on Thursday, “both parties agreed that efforts to promote national reconciliation in Libya are necessary to ensure long-term peace and prosperity throughout the country.” They also discussed “the need for concerted and tangible efforts by Libyan parties to make progress towards holding elections on schedule and ensuring fair revenue distribution,” according to the tweet. ",https://english.aawsat.com/arab-world/4323641-icc-track-down-perpetrators-%E2%80%98war-crimes%E2%80%99-libya,MR
LIB202305-15,Libya,620,,Bahrain,BHR,50.55,26,13,5,2023,Bahrain,CON_18,CON_18,692,1,,,1,1,0,,,,"Mangoush visited Bahrain on Saturday as part of her tour to several countries ahead of the Jeddah summit. She is aiming to coordinate and support joint Arab efforts and positions on regional challenges, especially in Sudan. The tour also seeks to garner Arab support for the elections in Libya and preserving consensus on supporting its stability.",https://english.aawsat.com/gulf/4328346-saudi-arabia-mulling-reopening-its-embassy-libya,MR
LIB202305-16,Libya,620,,Muscat,OMN,58.5922,23.6139,14,5,2023,Oman,CON_606,CON_606,698,1,Sayyid Badr Hamad Al Busaidi; Khalid Hashel Al Muselhi,,1,1,0,,,,"Sayyid Badr Hamad Al Busaidi, Foreign Minister, yesterday held a session of political talks with Dr. Najla Mohammed El Mangoush, Minister of Foreign Affairs and International Collaboration of Libya, who is on an official visit to the Sultanate of Oman. During the meeting, the two sides affirmed their keenness to cement ties between the two countries and two peoples. They discussed aspects of bilateral cooperation in political, economic and cultural fields, in addition to ways of maximizing mutual benefits for both countries. About developments in the Libyan arena, the Libyan Minister spoke about the efforts made to achieve internal political consensus and enhance the role undertaken by the representative of the United Nations Secretary-General. Sayyid Badr reiterated Oman’s firm support for those efforts and endeavours between Libyan parties to preserve the unity and sovereignty of the State of Libya, with the help of the United Nations, Arab and friendly countries to achieve Libya’s supreme interests in a manner that consolidates the pillars of security and stability and promotes the country’s comprehensive development programmes.The meeting was attended by Khalid Hashel Al Muselhi, Head of the Minister’s Office Department, officials of the Foreign Ministry, the Chargé d’Affaires of the Libyan Embassy in Oman and the delegation accompanying the Libyan Minister.",https://timesofoman.com/article/130860-oman-and-libya-to-bolster-relations,MR
LIB202305-17,Libya,620,,Qatar,QAT,51.25,25.5,14,5,2023,Qatar,CON_486,CON_486,694,1,Mohammed bin Abdulrahman bin Jassim Al Thani,,1,1,0,,,,"In other news, Foreign Minister Najla al-Mangoush arrived in Qatar on Sunday on the second stop in a tour before the Arab League summit in Saudi Arabia on Friday. She met with Qatari Prime Minister and Minister of Foreign Affairs, Mohammed Bin Abdul Rahman Al-Thani, praising Doha’s role in supporting the stability of Libya and the electoral process.",https://english.aawsat.com/gulf/4328346-saudi-arabia-mulling-reopening-its-embassy-libya,MR
LIB202312-4,Libya,620,,Benghazi,LBY,20.0667,32.1167,11,12,2023,UNSMIL,IGO_750,IGO_750,,1,Abdoulaye Bathily,UNSMIL process,2+,,0,,,,"In Benghazi on 11 and 12 December, the Special Representative met with representatives of political parties and social councils, respectively, who shared their perspectives on ways to build intra-Libyan consensus to advance the political process",https://unsmil.unmissions.org/sites/default/files/n2408061.pdf,MR
LIB202312-5,Libya,620,,Tripoli,LBN,35.8344,34.4367,13,12,2023,UNSMIL,IGO_750,IGO_750,,1,,UNSMIL process,2+,,0,,,,"At a meeting with UNSMIL in Tripoli on 13 December, 15 youth activists, including 9 women, shared their proposals to overcome the political deadlock. In addition, they recommended introducing a youth quota in parliament and other measures to enable young people to contribute to shaping the future of Libya",https://unsmil.unmissions.org/sites/default/files/n2408061.pdf,MR
LIB202312-6,Libya,620,,Cairo,EGY,31.2358,30.0444,16,12,2023,Egypt; UNSMIL,CON_82;IGO_750,CON_82; IGO_750,651; ,2,Abdoulaye Bathily,UNSMIL process; Egyptian Initiative,2+,1,0,,,,"Key factions involved in Libya met in Cairo over the weekend, according to several reports in the region. These include President Mohamed Menfi of the Presidential Council, the Speaker of the House of Representatives Aqilah Saleh, and Khalifa Haftar, who runs eastern Libya. They are all involved in discussions that could lead to some kind continued progress in a brokered settlement to end years of conflict in Libya. Egypt backs the talks and UN envoy Abdoulaye Bathily has backed the dialogue. These tripartite talks are a continuation of talks over the past year. In January Haftar and Saleh also met in Egypt. At the time, Egyptian and Libyan sources told Asharq Al-Awsat “that they will meet with Egyptian officials for talks on several Libyan political and military issues.” Al-Ain media, which is based in the UAE, noted that “the meeting, hosted by Cairo, aims to urge Aqilah Saleh and Haftar to participate in the international dialogue, in addition to discussing the reconstruction of Derna, after receiving the World Bank report in particular.” Derna was harmed by floods this year. Aqilah Saleh recently was in Turkey where he met with the Turkish leadership.",https://www.jpost.com/middle-east/article-778395,M
LIB202312-7,Libya,620,,,,,,18,12,2023,UNSMIL,IGO_750,IGO_750,,1,Abdoulaye Bathily,UNSMIL process,2+,1,0,,,,"Bathily briefed UNSC on his latest initiatve to convene meeting of Libya's five main political stakeholders. He said that all invitees had submitted names of their respective delegations but lamented that “Libyan leaders show no commitment to ending the long-standing stalemate”. Stakeholders have reportedly stated irreconcilable conditions for their participation. Notably, eastern-based House of Representatives (HoR) Speaker Aguila Saleh conditioned attendance to focusing discussions on formation of “new govt for elections” and rejected participation of Tripoli-based PM Abdelhamid Dabaiba on grounds that he is no longer legitimate. Meanwhile, Dabaiba, while ready to discuss outstanding issues in electoral laws, categorically rejected any discussions on “new govt”. Libyan National Army (LNA) chief Khalifa Haftar conditioned Dabaiba’s Govt of National Unity (GNU) participation to inclusion of HoR-appointed govt, or exclusion of both govts.",,M
LIB202305-18,Libya,620,,Tripoli,LBN,35.8344,34.4367,16,5,2023,Netherlands,CON_10,CON_10,210,1,Paul Huijts,,1,1,0,,,,"The Vice Foreign Minister of the Netherlands, Paul Huijts, has reaffirmed his country's position in support of peace and stability in Libya, and holding comprehensive elections that express the will of the Libyan people. Huijts expressed in a meeting with the Libyan Prime Minister Abdul Hamid Dbeibah in Tripoli his happiness at the opening of the new headquarters of the Dutch embassy in Tripoli after its expansion, while Dbeibah expressed his appreciation for the Libyan-Dutch bilateral relations, stressing the importance of facilitating the granting of visas to Libyan citizens. Huijts  added that the Netherlands fully supports Libya and the UN in their pursuit of lasting peace through elections and inclusivity, adding that ""Together, let's build a future where every voice matters.""",https://libyaobserver.ly/news/dbeibah-dutch-vice-foreign-minister-hold-meeting-following-embassys-reopening,MR
LIB202401-21,Libya,620,,Tunis,TUN,10.1817,36.8064,9,1,2024,UNSMIL,IGO_750,IGO_750,,1,,UNSMIL process,2+,1,0,,,,"On 9 and 10 January 2024, UNSMIL hosted a workshop in Tunis to improve collaboration between the House of Representatives, the High State Council and security institutions on reforming the security sector. Members of the House of Representatives, the High State Council and the 5+5 Joint Military Commission participated in the workshop, in addition to other security officials and civil society representatives. Participants included one woman from the House of Representatives and six from civil society organizations from across the country. The workshop emphasized the role of legislative authorities and civil society in security sector reform and produced recommendations, including on the demilitarization of urban areas and avoiding the use of military forces for internal security",https://unsmil.unmissions.org/sites/default/files/n2408061.pdf,MR
LIB202305-19,Libya,620,,Kuwait,KWT,47.6581,29.3375,16,5,2023,Kuwait,CON_563;CON_563,CON_563; CON_563,692; 690,1,Salem al-Sabah,,1,1,0,,,,"Kuwait's Foreign Minister Sheikh Salem Al-Sabah received on Tuesday his visiting Libyan counterpart Najla El-Mangoush, holding talks on bilateral relations and current developments around the world. The Kuwaiti Foreign Minister reiterated his country's unwavering support for Libya and the measures Tripoli takes to protect its security and stability, while the Libyan minister highlighted her appreciation of Kuwait's contributions towards peace in the region.",https://www.kuna.net.kw/ArticleDetails.aspx?id=3094849&language=en;https://www.kuna.net.kw/ArticleDetails.aspx?id=3094849&language=en,MR
