med_event_ID,conflict_country,conflict_counry_ID,conflict_id,med_location - MULTISELECT,med_loc_cty,med_loc_x,med_loc_y,Day,Month,Year,third_party,third_party_id_GLOPAD,third_party_id,third_party_id_PAX,num_med,individual_med_named,groupings_mechanisms,num_local,if_loc_belig,agmt,ceasefire,agmt_name,agmt_id_PAX,Summary,source_urls,med_type
LIB202301-1,Libya,620,,Cairo,EGY,31.2358,30.0444,5,1,2023,Egypt,CON_82,CON_82,651,1,Hanafy el-Gebaly,Egyptian Initiative,2+,1,1,,Joint statement on next steps (election related),,"Heads of rival assemblies, Aghela Saleh of Tobruk-based House of Representatives (HoR) and Khaled Mishri of Tripoli-based High State Council (HSC), 5 Jan met in Egyptian capital Cairo, pledged in vaguely-worded joint statement to refer amended constitutional draft to their respective chambers..... As a result of a meeting between Mr. Saleh and Mr. Mishri on 5 January in Cairo, the two leaders announced that they would task a joint committee composed of members of the two chambers with submitting a draft constitutional basis to the two houses for consideration and that they would later set out a road map for the holding of elections.... the resumption of talks between Speaker of the House of Representatives Aguila Saleh and President of the High State Council Khaled Mishri. The two met in Cairo on 5 January. In a statement following the meeting, UNSMIL “strongly encourage[d] the two chambers to now swiftly reach a complete and final agreement including on the contentious issues to finalize the steps required to take the country to inclusive national elections within a specific timeframe”..... In the past few days, Cairo has been the scene for several encounters between Libya’s rival parties. Speaker of Libya’s House of Representatives, Aguila Saleh, and chairman of the High Council of State (HCS), Khaled Al-Mishri, met in Cairo last Thursday where they achieved a breakthrough in negotiations the constitutional basis for elections in the country......In Egypt a conference between the two rival governments ended in an agreement to resolve differences over elections and hold those elections as soon as possible. The Tripoli faction was represented by the chairman of the High Council of State while the Tobruk faction sent the speaker of their parliament. This conference did not come up with a timeline, only that both sides would work out problems delaying national elections. That’s what everyone has been working on for over a year..... Khalid Almishri, head of the High Council of State, a body that acts as an upper house, met with the speaker of the Tobruk parliament, Aguilah Saleh, in Cairo on Thursday. Egyptian Parliament Speaker Hanafy El Gebaly arranged the face-to-face meeting, highlighting Egypt's role as a mediator in the Libyan crisis. Representatives of the two administrations came closer on the constitutional document that should govern the pre- and post-election period but left many issues unresolved. No dates or deadlines were mentioned. Nor did they determine whether dual citizens would be able to run for the presidency, or when candidates would have to resign from any office if they wished to run. After the meeting in Egypt, Almishri and Saleh agreed to meet again in Egypt to initial the final version of the legal text.",https://www.crisisgroup.org/crisiswatch/database?location%5B0%5D=95&crisis_state=&created=&from_month=1&from_year=2024&to_month=1&to_year=2024&page=2; https://unsmil.unmissions.org/sites/default/files/report_of_the_secretary-general_antonio_guterres_on_the_united_nations_support_mission_in_libya_-_05_april_2023.pdf; https://atalayar.com/index.php/en/content/saif-al-islam-gaddafi-emerges-alternative-libyas-two-warring-factions; https://www.securitycouncilreport.org/monthly-forecast/2023-02/libya-38.php; https://libyaupdate.com/possible-meeting-between-sisi-and-menfi-in-cairo-italian-press-reports/; http://www.strategypage.com/qnd/libya/articles/20230110.aspx; ,M
LIB202301-2,Libya,620,,United Arab Emirates,ARE,54,24,8,1,2023,United States; United Arab Emirates,CON_3;CON_591,CON_3; CON_591,2; 696,2,Derek Chollet,,0,,0,,,,"Counselor of the US State Department Derek Chollet will travel to the United Arab Emirates, January 8-10, where he will hold bilateral engagements with key Emirati officials on the latest regional and global developments, including Libya, according to US State Department. “On the sidelines of these multilateral meetings, he will hold bilateral engagements with key Emirati officials on the latest regional and global developments, including regarding the Russian war on Ukraine, Libya, and Iran, among others,” according to the statement.",https://libyaupdate.com/us-state-department-discuss-libya-with-key-officials-in-uae/,MR
LIB202301-3,Libya,620,,Cairo,EGY,31.2358,30.0444,9,1,2023,Egypt,CON_82,CON_82,651,1,,Egyptian Initiative,2+,1,0,,,,"The General Commander of the Libyan National Army (LNA), Field Marshal Khalifa Haftar, met today in Cairo with Chairman of the Presidential Council, Mohamed al-Menfi, according to multiple press reports. Haftar and Al-Menfi reportedly discussed deescalation efforts between Libya’s political parties. This is the second meeting between both leaders. The two first met in February of 2021 in Benghazi.... Yesterday, Menfi held a meeting in Cairo with General Commander of the Libyan National Army (LNA), Field Marshal Khalifa Haftar.",https://libyaupdate.com/haftar-and-menfi-hold-talks-in-cairo-report/; https://libyaupdate.com/possible-meeting-between-sisi-and-menfi-in-cairo-italian-press-reports/,M
LIB202301-4,Libya,620,,Cairo,EGY,31.2358,30.0444,11,1,2023,Egypt,CON_82,CON_82,651,1,,Egyptian Initiative,2+,1,0,,,,"Cairo 11 Jan hosted meeting between head of Presidential Council Mohamed Menfi and head of Libyan National Army, Field Marshall Khalifa Haftar",https://www.crisisgroup.org/crisiswatch/database?location%5B0%5D=95&crisis_state=&created=&from_month=1&from_year=2024&to_month=1&to_year=2024&page=2,M
LIB202301-5,Libya,620,,Riyadh,SAU,46.7167,24.6333,12,1,2023,Saudi Arabia; Egypt,CON_419;CON_82,CON_419; CON_82,670; 651,2,Faisal bin Farhan; Sameh Shoukry,,0,,0,,,,"The statement was released following a meeting between Saudi Foreign Minister Prince Faisal bin Farhan and his Egyptian counterpart Sameh Shoukry, who is visiting the Kingdom. The two oversaw the fifth ministerial session of the follow-up and political consultation committee between the two countries. The two sides also stressed their support of the UN-brokered Libyan dialogue. They praised the role of the Libyan House of Representatives and the state in “fulfilling all the frameworks that allow Libya to move toward a better future.” Presidential and parliamentary elections in Libya must be held as soon as possible, the statement said. Saudi Arabia thanked Egypt for hosting and sponsoring Libyan constitutional talks in Cairo in coordination with the UN.",https://www.arabnews.com/node/2231326/saudi-arabia,MR
LIB202301-6,Libya,620,,Tunis,TUN,10.1817,36.8064,16,1,2023,UNSMIL; Libya; Sudan; Chad; Niger; AU,IGO_750;CON_285;CON_158;CON_157;CON_142;GP-6,IGO_750; CON_285; CON_158; CON_157; CON_142; ,; 620; 625; 483; 436; ,6,Abdoulaye Bathily,UNSMIL process,0,,0,,,,"Bathily convened on the margins of the Security Working Group meeting in Tunis on Thursday, the Liaison Committees from Libya, Sudan, Chad, Niger and African Union to launch the data sharing mechanism for the withdrawal of mercenaries and foreign fighters, as per their commitment last month in Cairo. ""This information sharing mechanism will contribute to strengthen security in Libya and the sub region, enable a conducive environment for elections in 2023, and for a sustainable peace and stability."" He said on Twitter.",https://libyaobserver.ly/news/un-envoy-reviews-ceasefire-monitors-steps-mercenaries-withdrawal-libya,MR
LIB202301-7,Libya,620,,Cairo,EGY,31.2358,30.0444,22,1,2023,Egypt; Italy,CON_82;CON_139,CON_82; CON_139,651; 325,2,Abdel Fattah al-Sisi; Sameh Shoukry; Antonio Tajani,,0,,0,,,," Italy’s chief diplomat held talks Sunday with Egyptian and Arab League officials in Cairo that focused on regional security and the conflict in neighboring Libya, as well as sensitive bilateral issues. Tajani said his meeting with President Abdel Fattah el-Sissi also covered energy security and economic cooperation in the Mediterranean, but focused “above all” on political instability in Libya and the efforts to stop “irregular immigration” from that country.",https://apnews.com/article/politics-italy-government-libya-antonio-tajani-egypt-dc6f9fd9e9cb28e6a591cc72da34309c; https://www.newarab.com/news/italy-and-egypt-meet-discuss-libyas-political-stability,MR
LIB202301-8,Libya,620,,Cairo,EGY,31.2358,30.0444,15,1,2023,Egypt,CON_82,CON_82,651,1,,Egyptian Initiative,2+,1,0,,,,"A new round of negotiations kicked off in Cairo over the weekend between Libyan National Army (LNA) commander Khalifa Haftar, head of the Presidential Council Mohammed al-Menfi and Speaker of the east-based parliament Aguila Saleh. Egyptian and Libyan sources, however, told Asharq Al-Awsat that they will meet with Egyptian officials for talks on several Libyan political and military issues. They will cover the delayed presidential and parliamentary elections in wake of the recent understandings reached between the parliament and High Council of State. The two bodies had reached agreements over the elections’ constitutional foundations. .... 15 January held another meeting between Menfi, Haftar and Saleh. Saleh in following days however refused to sign off on document outlining key agreements between HoR and HSC and reaffirmed HoR is Libya’s one and only legislative body and does not need HSC’s approval, suggesting that HoR amend 2011 constitutional declaration “before March”.",https://english.aawsat.com/home/article/4100436/libya%E2%80%99s-haftar-menfi-saleh-return-cairo-negotiations; https://www.crisisgroup.org/crisiswatch/database?location%5B0%5D=95&crisis_state=&created=&from_month=1&from_year=2024&to_month=1&to_year=2024&page=2,M
LIB202301-9,Libya,620,,Sirte,LBY,16.5887,31.2089,15,1,2023,UNSMIL,IGO_750,IGO_750,,1,Abdoulaye Bathily,UNSMIL process,2+,1,0,,,,"Libya’s 5+5 Joint Military Committee 5+5 will meet on Sunday, January 15, in Sirte in the presence of the United Nations envoy to Libya, Abdoulaye Bathily… The Joint Military Commission met on 15 and 16 January, during which UN Special Representative for Libya Abdoulaye Bathily announced the launch of joint work between the international ceasefire monitoring team and Libyan monitors in Sirte.....On 15 and 16 January, the Special Representative chaired a meeting with the Commission in Sirte. At the meeting, the Commission approved the terms of reference of a subcommittee on disarmament, demobilization and reintegration, requested UNSMIL to facilitate the Commission’s engagement with armed groups and decided to initiate the work of the liaison committees of Chad, the Niger, the Sudan and the African Union to enhance coordination on the withdrawal of foreign fighters and mercenaries from Libya... The head of the UN Support Mission in Libya — also known as UNSMIL — Abdoulaye Bathily, he announced on Sunday the launch of joint work between the international ceasefire monitoring team and Libyan monitors in Sirte — the meeting took place in Sirte.  During the meeting of the Joint Military Commission 5+5, he encouraged the Joint Military Commission to move forward in implementing the ceasefire agreement. And during the meeting, several issues were covered including moving forward with the Libyan ceasefire monitoring mechanism and the withdrawal of mercenaries and foreign fighters, jointly developed by Libyan and international monitors....The U.N. Envoy, Abdoulaye Bathily, arrived in Sirte today to chair the meeting of the 5+5 Joint Military Committee in the presence of the Libyan ceasefire monitors and their international counterparts. ",https://libyaupdate.com/un-libyas-55-jmc-to-hold-meeting-in-sirte-next-sunday-report/; https://www.securitycouncilreport.org/monthly-forecast/2023-02/libya-38.php; https://libyaupdate.com/un-envoy-arrives-in-sirte-for-55-jmc-meeting/; https://press.un.org/en/2023/db230116.doc.htm; https://unsmil.unmissions.org/sites/default/files/report_of_the_secretary-general_antonio_guterres_on_the_united_nations_support_mission_in_libya_-_05_april_2023.pdf; https://www.crisisgroup.org/crisiswatch/database?location%5B0%5D=95&crisis_state=&created=&from_month=1&from_year=2024&to_month=1&to_year=2024&page=2,M
LIB202302-1,Libya,620,,Moscow,RUS,37.6172,55.7558,2,2,2023,Russia; Iran (Islamic Republic of),CON_21;CON_289,CON_21; CON_289,365; 630,2,Ali Asghar Khaji; Vladimir Bogdanov,,0,,0,,,,"Senior adviser to Iranian foreign minister for special political affairs Ali Asghar Khaji, who is visiting Moscow for consultations with Russian officials, held a meeting with the Russian president’s special representative for the Middle East and North Africa Vladimir Bogdanov on Wednesday. The latest developments in Libya were also among the topics discussed in the meeting. The parties underscored the necessity of protecting the territorial integrity of Libya and realization of national solidarity and restoration of peace and security in the North African country.",https://www.tasnimnews.com/en/news/2023/02/02/2847063/iran-russia-discuss-regional-developments,MR
LIB202301-10,Libya,620,,Tripoli,LBN,35.8344,34.4367,17,1,2023,Turkey,CON_562,CON_562,640,1,Hakan Fidan,,2+,1,0,,,,"On Tuesday evening, the head of Turkish intelligence met separately with Al-Mashri, Mohamed al-Menfi, president of the Libyan Presidential Council and Dbeibeh, before holding a meeting at the house of Dbeibeh’s brother-in-law, in the presence of General Othman Itaj, the commander of the Turkish forces in western Libya, Al-Mashri, Dbeibeh and Abdullah Al-Lafi.",https://english.aawsat.com/home/article/4107346/turkish-intelligence-chief-holds-reconciliation-between-mishri-debeibeh; https://www.crisisgroup.org/crisiswatch/database?location%5B0%5D=95&crisis_state=&created=&from_month=1&from_year=2024&to_month=1&to_year=2024&page=2,M
LIB202302-2,Libya,620,,Addis Ababa,ETH,38.74,9.03,17,2,2023,AU; UNSG,GP-6;IGO_386,; IGO_386,; ,2,António Guterres; Moussa Faki Mahamat,,0,,0,,,,"At a meeting of the African Union’s (AU) High-level Committee on Libya, which took place on 17 and 18 February, Secretary-General António Guterres said that his Special Representative has been engaging relevant parties “to agree on a constitutional basis for elections by the end of this month”. At the conclusion of the 17-18 February AU meeting, Chairperson of the AU Commission Moussa Faki Mahamat announced that the regional organisation will host a national reconciliation conference for Libya. The conference—the date of which has yet to be confirmed—will be chaired by President of the Republic of Congo Denis Sassou Nguesso, who heads the AU High-level Committee on Libya.....In Addis Ababa, the Secretary-General took part in several high-level events.  He addressed the Roundtable on the Joint Sahel Assessment, the meeting of Heads of State and Government of the African Union Peace and Security Council on the situation in eastern Democratic Republic of the Congo, as well as the High-Level Committee on Libya.   In his remarks to the meeting on Libya, the Secretary-General said that the UN has no agenda and no goal but one:  to secure the right of the Libyan people to live in peace; to vote in free and fair elections; and to share in the prosperity of their country.  He warned that the absence of elections worsens economic insecurity, heightens political instability, risks renewed conflict, and raises the spectre of partition.... UN Secretary-General António Guterres’ remarks, as prepared for delivery, at the African Union High-Level Committee on Libya, in Addis Ababa today..... I welcome the opportunity to address this African Union High-Level Committee.  My thanks to [Democratic Republic of the Congo] President [Denis] Sassou Nguesso for his stewardship of the African Union’s efforts on Libya.... I reiterate my call for all countries involved to respect the integrity of international refugee law, and for Libyan authorities to find rights-based alternatives to detention, in line with international human rights law.  The United Nations and the African Union — together with other key regional actors and organizations — must work together to support the Libyan people in realizing their legitimate aspirations to a more peaceful and prosperous future.  I count on your unwavering commitment.",https://www.securitycouncilreport.org/whatsinblue/2023/02/libya-briefing-and-consultations-12.php; https://press.un.org/en/2023/sgsm21690.doc.htm; https://press.un.org/en/2023/db230217.doc.htm,MR
LIB202302-3,Libya,620,,Washington,USA,-77.0163,38.9047,23,2,2023,Egypt; France; Germany; Qatar; Turkey; United Arab Emirates; United Kingdom; United States; UNSMIL,CON_82;CON_7;CON_2;CON_2;CON_486;CON_562;CON_591;CON_19;CON_3;IGO_750,CON_82; CON_7; CON_2; CON_2; CON_486; CON_562; CON_591; CON_19; CON_3; IGO_750,651; 220; 255; 260; 694; 640; 696; 200; 2; ,9,Abdoulaye Bathily,UNSMIL process,0,,0,,,,"On 23 February, the Special Representative attended a meeting of representatives from Egypt, France, Germany, Qatar, Türkiye, the United Arab Emirates, the United Kingdom and the United States in Washington, D.C., to discuss the situation in Libya. He expressed concern about the implications associated with the status quo and encouraged international partners to remain unified in their position on the Libyan crisis.... He has also consulted with international partners, notably meeting with representatives of Egypt, France, Germany, Italy, Qatar, Türkiye, the United Arab Emirates, the UK, and the US in Washington DC yesterday (23 February).",https://www.securitycouncilreport.org/whatsinblue/2023/02/libya-briefing-and-consultations-12.php; https://unsmil.unmissions.org/sites/default/files/report_of_the_secretary-general_antonio_guterres_on_the_united_nations_support_mission_in_libya_-_05_april_2023.pdf,MR
LIB202304-1,Libya,620,,Khartoum,SDN,32.5,15.6,3,4,2023,UNSMIL; Sudan,IGO_750;CON_158,IGO_750; CON_158,; 625,2,Abdoulaye Bathily; Abdulfattah Burhan; Ali al-Sadiq; Yassin Ibrahim,UNSMIL process,0,,0,,,,"Special Representative of the Secretary General (SRSG) in Libya, Abdoulaye Bathily, today concluded his first official visit to Libya's southern neighbours, Sudan, Chad and Niger. During the visit he discussed restoring peace and stability in Libya, including through the withdrawal of foreign fighters, foreign forces and mercenaries from the country with adequate coordination. In Khartoum, SRSG Bathily was received by President of the Transitional Sovereignty Council of Sudan, H.E. Abdulfattah Burhan. The President expressed his support for UNSMIL's efforts towards peace and stability in Libya which would also contribute to the stability of the region. He agreed that one of the actions needed to restore peace in Libya was the return of foreign fighters, foreign forces, and mercenaries to their countries of origin.....Prior to the meeting with President Burhan, SRSG Bathily met with the Sudanese Minister of Foreign Affairs, H.E. Ali Al-Sadiq. They discussed recent political developments in Libya and the need to consolidate efforts to address the common challenges facing Sudan and Libya, including border security....During the visit he discussed restoring peace and stability in Libya, including through the withdrawal of foreign fighters, foreign forces and mercenaries from the country with adequate coordination. In his meeting with the Minister of Defence of Sudan, General Yassin Ibrahim, they reviewed the progress achieved by the 5+5 JMC and the Liaison Committees from Libya, Sudan, Chad and Niger. General Ibrahim confirmed his commitment to pursing a coordinated withdrawal of foreign fighters and mercenaries from Libya and to reintegrating qualified candidates into relevant institutions.",https://reliefweb.int/report/libya/srsg-bathily-visits-chad-sudan-and-niger-renew-their-shared-commitment-withdrawal-foreign-fighters-and-mercenaries-libya,MR
LIB202304-2,Libya,620,,N'Djamena,TCD,15.05,12.11,4,4,2023,UNSMIL; Chad,IGO_750;CON_157,IGO_750; CON_157,; 483,2,Abdoulaye Bathily; Mahamat Idriss Deby; Mahamat Salah Annadif; Daoud Yaya,UNSMIL process,0,,0,,,,"Special Representative of the Secretary General (SRSG) in Libya, Abdoulaye Bathily, today concluded his first official visit to Libya's southern neighbours, Sudan, Chad and Niger. During the visit he discussed restoring peace and stability in Libya, including through the withdrawal of foreign fighters, foreign forces and mercenaries from the country with adequate coordination. SRSG Bathily was received in N'Djamena by the Transitional President, General Mahamat Idriss Déby, who expressed appreciation for initiating this high-level consultation on a key strategic issue important to Libya and Chad alike. President Déby was clear that peace and stability in Libya is also in the best interests of Chad and therefore pledged his further cooperation....SRSG Bathily also met with the Minister of Foreign Affairs, Chadians Abroad and International Cooperation, Mahamat Saleh Annadif to discuss efforts to hold inclusive elections this year in Libya. He expressed Chad's support to the UN for its good offices in Libya..... To discuss the technicalities of the withdrawal process and to help reach common understanding, SRSG Bathily separately met with the Chadian Minister for Public Security and Immigration, Mahamat Margui and Minister of General Defence Daoud Yaya. They both expressed support for the UN efforts in facilitating a coordinated withdrawal of these elements. They stressed the imperative of adequate processes of repatriation and disarmament, demobilization and reintegration.",https://reliefweb.int/report/libya/srsg-bathily-visits-chad-sudan-and-niger-renew-their-shared-commitment-withdrawal-foreign-fighters-and-mercenaries-libya,MR
LIB202304-3,Libya,620,,Niamey,NER,2.1175,13.515,5,4,2023,Niger; UNSMIL,CON_142;IGO_750,CON_142; IGO_750,436; ,2,Abdoulaye Bathily; Mohamed Bazoum; Alkassoum Indattou; Alkache Alhada,UNSMIL process,0,,0,,,,"Special Representative of the Secretary General (SRSG) in Libya, Abdoulaye Bathily, today concluded his first official visit to Libya's southern neighbours, Sudan, Chad and Niger. During the visit he discussed restoring peace and stability in Libya, including through the withdrawal of foreign fighters, foreign forces and mercenaries from the country with adequate coordination. ""I was honored to be received by the President of the Republic of Niger, H.E. Mohamed Bazoum, who commended the UN's efforts to stabilize Libya at this critical time,"" said SRSG Bathily, adding that they discussed the progress made on the security track and efforts towards the holding of elections this year....Earlier in the day, SRSG Bathily met with Niger's Minister of National Defence, H.E. Alkassoum Indattou and Minister of Interior and Public Security, Mr Alkache Alhada, to review the coordination mechanisms of the 5+5 JMC committee to facilitate the withdrawal of Nigerien mercenaries and fighters from Libya. They also discussed enhancing border security between Niger and Libya to prevent cross-border trafficking.",https://reliefweb.int/report/libya/srsg-bathily-visits-chad-sudan-and-niger-renew-their-shared-commitment-withdrawal-foreign-fighters-and-mercenaries-libya,MR
LIB202304-4,Libya,620,,Virtual ,0, , ,8,4,2023,UNSMIL; United States,IGO_750;CON_3,IGO_750; CON_3,; 2,2,Abdoulaye Bathily; Richard Norland,UNSMIL process,0,,0,,,,"The US Ambassador to Libya, Richard Norland, welcomed the meetings of military and security leaders in Benghazi during a phone call with the UN Envoy to Libya, Abdoulaye Bathily on Saturday. Norland said both he and Bathily commended the leaders who met together in Benghazi ""to reaffirm their commitment to Libya’s sovereignty and political stability through elections and the departure of foreign fighters, forces, and mercenaries.” The US official also thanked Bathily for his efforts to promote national consensus towards elections in Libya.",https://libyaobserver.ly/news/norland-welcomes-security-meeting-benghazi,MR
LIB202304-5,Libya,620,,Riyadh,SAU,46.7167,24.6333,30,4,2023,Saudi Arabia; UNSMIL,CON_419;IGO_750,CON_419; IGO_750,670; ,2,Abdoulaye Bathily; Faisal bin Farhan Al Saud,UNSMIL process,0,,0,,,,"On 30 April, the Special Representative met with the Minister of Foreign Affairs of Saudi Arabia, Prince Faisal bin Farhan Al Saud, in Riyadh. Discussions centred on measures required to support the unity of Libyan institutions and to achieve a Libyan-owned pathway towards the holding of presidential and parliamentary elections.",https://unsmil.unmissions.org/sites/default/files/s-2023-589_-_sg_report_on_unsmil.pdf,MR
